{
  "$schema": "http://json-schema.org/draft-07/schema#",
  "$id": "https://lima.local/schemas/cve-index-entry.json",
  "title": "LIMA offline CVE index (one JSON file = one array of entries)",
  "description": "Frozen entry contract for the offline CVE matcher in lima/agent_report.py (plan Task 6). load_cve_index enforces the same rules without a jsonschema dependency: exactly these six fields, CVE id pattern, non-empty component/affected_paths/summary, string commits (empty string = unknown timeline).",
  "type": "array",
  "items": {
    "type": "object",
    "additionalProperties": false,
    "required": [
      "cve_id",
      "component",
      "affected_paths",
      "introduced_commit",
      "fixed_commit",
      "summary"
    ],
    "properties": {
      "cve_id": {
        "type": "string",
        "pattern": "^CVE-[0-9]{4}-[0-9]{4,}$"
      },
      "component": {
        "type": "string",
        "minLength": 1,
        "description": "Component path; matched as a mutual non-empty prefix of the finding's component."
      },
      "affected_paths": {
        "type": "array",
        "minItems": 1,
        "items": {
          "type": "string",
          "minLength": 1
        },
        "description": "fnmatch globs (fnmatchcase, case-exact) over the finding's repository-relative path."
      },
      "introduced_commit": {
        "type": "string",
        "description": "Introducing commit hash; empty string means unknown timeline."
      },
      "fixed_commit": {
        "type": "string",
        "description": "Fixing commit hash; empty string means unknown timeline."
      },
      "summary": {
        "type": "string",
        "minLength": 1
      }
    }
  }
}
